{
  "$schema": "http://json-schema.org/draft-07/schema#",
  "title": "EGP Propose Operation",
  "description": "The art of offering - suggesting solutions to sense signals",
  "type": "object",
  "properties": {
    "title": {
      "type": "string",
      "description": "Human-readable name",
      "minLength": 5,
      "maxLength": 200,
      "examples": ["Moonlight Water Sharing", "Moonlight Irrigation & Ancient Terracing Revival"]
    },
    "in_response_to": {
      "type": "string",
      "description": "URI of the sense() call this addresses",
      "pattern": "^/sense/[a-zA-Z0-9]+$",
      "examples": ["/sense/123", "/sense/bafyrei..."]
    },
    "solution": {
      "type": "object",
      "description": "The proposed solution",
      "properties": {
        "description": {
          "type": "string",
          "description": "Brief description of the solution",
          "minLength": 10,
          "maxLength": 1000,
          "examples": [
            "Farmers take turns at night to reduce evaporation",
            "Combine night irrigation (reduces evaporation 40%) with restoring traditional Atacameño water terraces. Use buried clay pots (ollas) for slow-release watering."
          ]
        },
        "format": {
          "type": "string",
          "description": "MIME type of the solution content",
          "enum": ["text/plain", "text/markdown", "text/html"],
          "default": "text/markdown",
          "examples": ["text/markdown"]
        },
        "content": {
          "type": "string",
          "description": "Detailed content, diagrams, etc. Base64-encoded if binary",
          "maxLength": 10000,
          "examples": [
            "![Moonlit irrigation sketch](...)",
            "## Solution Overview\n\n### Phase 1: Immediate Relief (Week 1-2)\n- Schedule irrigation between 10pm-4am when evaporation is minimal\n- Install shade cloth over most vulnerable plants\n- Implement water rationing: 2L per family plot per day\n\n### Phase 2: Traditional Revival (Month 1-3)\n- Work with elders to map original terrace locations\n- Rebuild 3 key terraces using traditional stone-laying techniques\n- Install 20 buried clay ollas for efficient water storage\n\n### Phase 3: Community Resilience (Month 3-6)\n- Train 5 young people in traditional water management\n- Create seed bank for drought-resistant native varieties\n- Establish water council with rotating leadership\n\n![Terrace sketch](data:image/png;base64,iVBORw0KGgoAAAANSUhEUgAA...)"
          ]
        }
      },
      "required": ["description", "format"],
      "additionalProperties": false
    },
    "test": {
      "type": "string",
      "description": "Success criteria (human or machine-readable)",
      "minLength": 10,
      "maxLength": 500,
      "examples": [
        "Conflict drops 20% in 2mo",
        "Garden produces 80% of normal harvest despite 60% less water. Community conflict over water drops to zero. At least 3 youth learn traditional techniques."
      ]
    },
    "sunset": {
      "type": "string",
      "description": "ISO 8601 duration until auto-expiry",
      "pattern": "^P(\\d+Y)?(\\d+M)?(\\d+W)?(\\d+D)?(T(\\d+H)?(\\d+M)?(\\d+S)?)?$",
      "examples": ["P6M", "P4M"]
    },
    "resources": {
      "type": "object",
      "description": "Resources needed and offered",
      "properties": {
        "needed": {
          "type": "array",
          "items": {
            "type": "string",
            "maxLength": 100
          },
          "maxItems": 20,
          "examples": [
            ["jugs", "volunteers"],
            ["clay_pots", "shade_cloth", "hand_tools", "elder_knowledge_holders"]
          ]
        },
        "offered": {
          "type": "array",
          "items": {
            "type": "string",
            "maxLength": 100
          },
          "maxItems": 20,
          "examples": [
            ["land_access", "elders_council"],
            ["young_volunteer_labor", "traditional_stone_quarry_access", "community_meeting_space", "monthly_follow_up_commitment"]
          ]
        }
      },
      "additionalProperties": false
    },
    "proposer": {
      "type": "object",
      "description": "Information about the proposer",
      "properties": {
        "did": {
          "type": "string",
          "description": "Decentralized identifier of the proposer"
        },
        "type": {
          "type": "string",
          "enum": ["individual", "organization", "ai", "collective"],
          "description": "Type of entity making the proposal"
        },
        "credentials": {
          "type": "array",
          "items": {
            "type": "string"
          },
          "description": "Relevant credentials or qualifications"
        }
      }
    },
    "metadata": {
      "type": "object",
      "description": "Additional context-specific metadata",
      "additionalProperties": true
    }
  },
  "required": ["title", "in_response_to", "solution", "test", "sunset"],
  "additionalProperties": false,
  "examples": [
    {
      "title": "Moonlight Water Sharing",
      "in_response_to": "/sense/123",
      "solution": {
        "description": "Farmers take turns at night to reduce evaporation",
        "format": "text/markdown",
        "content": "![Moonlit irrigation sketch](...)"
      },
      "test": "Conflict drops 20% in 2mo",
      "sunset": "P6M",
      "resources": {
        "needed": ["jugs", "volunteers"],
        "offered": ["land_access", "elders_council"]
      }
    },
    {
      "title": "Moonlight Irrigation & Ancient Terracing Revival",
      "in_response_to": "/sense/bafyrei...",
      "solution": {
        "description": "Combine night irrigation (reduces evaporation 40%) with restoring traditional Atacameño water terraces. Use buried clay pots (ollas) for slow-release watering.",
        "format": "text/markdown",
        "content": "## Solution Overview\n\n### Phase 1: Immediate Relief (Week 1-2)\n- Schedule irrigation between 10pm-4am when evaporation is minimal\n- Install shade cloth over most vulnerable plants\n- Implement water rationing: 2L per family plot per day\n\n### Phase 2: Traditional Revival (Month 1-3)\n- Work with elders to map original terrace locations\n- Rebuild 3 key terraces using traditional stone-laying techniques\n- Install 20 buried clay ollas for efficient water storage\n\n### Phase 3: Community Resilience (Month 3-6)\n- Train 5 young people in traditional water management\n- Create seed bank for drought-resistant native varieties\n- Establish water council with rotating leadership\n\n![Terrace sketch](data:image/png;base64,iVBORw0KGgoAAAANSUhEUgAA...)"
      },
      "test": "Garden produces 80% of normal harvest despite 60% less water. Community conflict over water drops to zero. At least 3 youth learn traditional techniques.",
      "sunset": "P6M",
      "resources": {
        "needed": ["clay_pots", "shade_cloth", "hand_tools", "elder_knowledge_holders"],
        "offered": ["young_volunteer_labor", "traditional_stone_quarry_access", "community_meeting_space", "monthly_follow_up_commitment"]
      }
    }
  ]
}
